{
  "framework_id": "b4d5e6f7-0000-4c11-8a2b-3c4d5e6f7a8b",
  "buyer_authority_id": "11111111-2222-5333-8444-555555555555",
  "establishing_notice_id": "7c1e2d3f-4a5b-4c6d-8e7f-90a1b2c3d4e5",
  "country": "PRT",
  "title": "Acordo-quadro para fornecimento de material de escritório",
  "ceiling_eur": 4000000.0,
  "ceiling_currency": "EUR",
  "ceiling_original": 4000000.0,
  "reestimated_value_eur": 2750000.0,
  "duration_start": "2025-01-01",
  "duration_end": "2028-12-31",
  "duration_months": 48,
  "cpv": "30190000",
  "lot_count": 2,
  "supplier_count": 3,
  "suppliers": [
    {
      "company_gmr_id": "00040372-dad6-5d34-882c-8b8624b4e734",
      "lot": "LOT-0001",
      "rank": 1
    },
    {
      "company_gmr_id": "11111111-2222-5333-8444-666666666666",
      "lot": "LOT-0001",
      "rank": 2
    },
    {
      "company_gmr_id": "22222222-3333-5444-8555-777777777777",
      "lot": "LOT-0002"
    }
  ]
}
